platform,canonical_error_key,platform_codes,message_we_received,why_this_happens,what_user_should_do
LinkedIn,account_restricted,HTTP:401,Member is restricted,The platform has restricted the account from publishing or uploading media. This restriction is enforced by the platform and is outside our direct control.,"Ask the user to open the platform account and check account status, account quality, or support inbox. They need to resolve the restriction on the platform before retrying."
LinkedIn,missing_platform_permission,HTTP:403,Accessing this image resource is forbidden. Please check your permissions for this resource,LinkedIn rejected access to the image or video resource. LinkedIn requires the token and owner to match the member/page/organization that owns the media.,"Ask the user to reconnect LinkedIn and confirm they are publishing to a page or profile they administer. If the media was uploaded under another owner, upload it again under the correct account."
LinkedIn,temporary_platform_error,HTTP:500 | HTTP:503 | HTTP:524,[IncomingMessage],"The platform returned a temporary server error or service unavailable response. The request reached the platform, but the platform could not complete it.","Ask the user to retry later. If many posts fail across accounts, treat it as a platform incident and escalate internally."
LinkedIn,account_authorization_revoked,HTTP:401,The token used in the request has been revoked by the user,"The user or the platform removed the app authorization. Our system can still see the account record, but the platform no longer accepts the stored permission.","Ask the user to reconnect the social account in bundle.social and approve all requested permissions again. If the account manages a page, they should also reselect the page during reconnect."
LinkedIn,network_error,HTTP:502 | NET:EAI_AGAIN | NET:ECONNRESET,connect ETIMEDOUT 108.174.10.22:443,"A network or DNS error interrupted the request between our system, media storage, and the platform.","Ask the user to retry. If multiple retries fail or many accounts are affected, escalate to support as an infrastructure/platform connectivity issue."
LinkedIn,duplicate_content,LI:422,com.linkedin.content.common.exception.BadRequestResponseException: Content is a duplicate of URN,The platform detected that the post duplicates content that was already published or recently submitted.,"Ask the user to change the text or media meaningfully, then publish again."
LinkedIn,media_processing_failed,HTTP:422,LinkedIn processing failed for image,"The platform accepted the upload but could not process the media. Common reasons include unsupported format, corrupt file, too large media, or platform processing failure.","Ask the user to re-export the media in a standard format and retry. For images, use common JPG/PNG. For videos, use MP4/H.264 when possible."
LinkedIn,media_processing_timeout,HTTP:504,No final status after 6 attempts,The platform did not finish processing the media within the expected time.,"Ask the user to retry later or upload a smaller/simpler media file. If many users see this at once, treat it as a platform issue."
X / Twitter,action_not_permitted,HTTP:403 | TW:403,You are not permitted to perform this action.,"The platform does not allow the connected account to perform this action. This can be caused by account type, role, missing permission, or platform-side restriction.","Ask the user to confirm they are using the correct account, page, and role. If the action is still blocked, reconnect the account and retry with a simpler post."
X / Twitter,account_suspended,HTTP:403 | TW:user-suspended,Request failed with code 403 - Your account is suspended and is not permitted to access this feature. (Twitter code 64),The platform reports that the account or channel is suspended. Suspended accounts cannot publish through the API.,Ask the user to resolve the suspension directly with the platform. Publishing can resume only after the platform restores the account.
X / Twitter,account_temporarily_locked,HTTP:403 | HTTP:502 | TW:403,Your account is temporarily locked. Please log in to URL to unlock your account.,"The platform temporarily locked the account, usually due to security or anti-spam checks.","Ask the user to log into the native platform and complete the unlock flow. After the account is unlocked, reconnect if needed and retry."
X / Twitter,temporary_platform_error,HTTP:500 | HTTP:503 | HTTP:520 | HTTP:522 | NET:503 | TW:503,Request failed with code 503,X/Twitter returned a temporary server or media-service error. This is usually not caused by the post content.,"Ask the user to retry later. If media upload status remains stuck or many accounts fail, escalate as a platform/media upload issue."
X / Twitter,account_connection_expired,HTTP:401 | TW:401,Request failed with code 401 - Invalid or expired token (Twitter code 89),"The access token or session used for publishing is no longer valid. This commonly happens after password changes, security checks, expired OAuth sessions, token revocation or just ""because"".","Ask the user to reconnect the platform account. After reconnecting, retry the post. If it fails again immediately, ask them to log into the native platform first and clear any security prompt."
X / Twitter,duplicate_content,TW:403,You are not allowed to create a Tweet with duplicate content.,The platform detected that the post duplicates content that was already published or recently submitted.,"Ask the user to change the text or media meaningfully, then publish again."
X / Twitter,video_duration_too_long,TW:403,This user is not allowed to post a video longer than 2 minutes.,The video is longer than the platform or account allows.,Ask the user to shorten the video or publish it directly on the platform if that account supports longer videos there.
X / Twitter,crypto_address_restriction,TW:403,Crypto addresses are prohibited for the first 7 days after authentication.,X/Twitter restricts crypto addresses for newly authenticated accounts during an initial safety period.,Ask the user to remove the crypto address from the post or wait until the platform restriction period ends.
X / Twitter,access_package_limitation,TW:403,"Creating posts with @mentions is not allowed for your access package. In replies to conversations you are part of, you may only @mention users who are already participants in the thread.","The connected account or API access level does not allow this publishing feature. In the observed X/Twitter case, posts with certain @mentions are blocked by the current access package.","Ask the user to remove the restricted feature from the post, such as unsupported @mentions, or confirm that their X API access level supports it. Escalate only if the account should have this access."
X / Twitter,invalid_media_reference,TW:invalid-request,Your media IDs are invalid.,The platform rejected the media ID or media reference. This usually means the media upload did not finish correctly or the reference expired.,"Ask the user to upload the media again and retry publishing. If it repeats, escalate with the failed media/post ID."
X / Twitter,network_error,NET:EAI_AGAIN | NET:ECONNRESET,aborted,"A network or DNS error interrupted the request between our system, media storage, and the platform.","Ask the user to retry. If multiple retries fail or many accounts are affected, escalate to support as an infrastructure/platform connectivity issue."
X / Twitter,media_processing_timeout,HTTP:504,No terminal state after repeated checks,The platform did not finish processing the media within the expected time.,"Ask the user to retry later or upload a smaller/simpler media file. If many users see this at once, treat it as a platform issue."
Threads,unknown_error,Meta:1,Unknown error,The platform did not return a specific reason. Our system only received a generic or empty error.,"Ask the user to retry once. If it repeats, escalate with the failed post ID, platform, and timestamp so support can inspect the raw platform response."
Threads,media_upload_failed,HTTP:502 | Meta:1:2207032,"Media upload failed, Threads did not returned status about your upload","The media upload did not complete successfully. This can be caused by platform upload processing, invalid media, expired upload sessions, or transient platform errors.","Ask the user to retry. If it repeats, ask them to replace or re-export the media file and try again."
Threads,action_temporarily_blocked,Meta:1:2207051,We restrict certain activity to protect our community. Tell us if you think we made a mistake.,"The platform temporarily blocked the action, commonly because of anti-spam, automation, or policy checks.","Ask the user to review the post content and account status, wait, then try again. If many posts failed, slow down publishing from that account."
Threads,media_fetch_failed,Meta:1:2207052,The media could not be fetched from this URI: URL check the limitations section in our development document for more information: URL,"Threads could not fetch the media from the hosted URL. Threads publishing uses Meta infrastructure, so crawler access and media URL availability matter.","Retry once. If it repeats, escalate so support can verify that the media URL is reachable by Meta/Threads and is not blocked."
Threads,account_restricted,Meta:25:4279013,Das Instagram- oder Threads-Konto wurde eingeschränkt.,The platform has restricted the account from publishing or uploading media. This restriction is enforced by the platform and is outside our direct control.,"Ask the user to open the platform account and check account status, account quality, or support inbox. They need to resolve the restriction on the platform before retrying."
Threads,temporary_platform_error,Meta:2,An unexpected error has occurred. Please retry your request later.,"The platform returned a temporary server error or service unavailable response. The request reached the platform, but the platform could not complete it.","Ask the user to retry later. If many posts fail across accounts, treat it as a platform incident and escalate internally."
Threads,media_fetch_timeout,Meta:1:2207003,Das Herunterladen der Medien dauert zu lange.,The platform took too long to download the media file.,Ask the user to retry later or use a smaller media file. Escalate if the same media repeatedly times out.
Threads,network_error,NET:EAI_AGAIN,getaddrinfo EAI_AGAIN graph.threads.net,"A network or DNS error interrupted the request between our system, media storage, and the platform.","Ask the user to retry. If multiple retries fail or many accounts are affected, escalate to support as an infrastructure/platform connectivity issue."
Pinterest,media_processing_timeout,PIN:PIN:UNKNOWN,"Media upload failed, Pinterest did not return status",The platform did not finish processing the media within the expected time.,"Ask the user to retry later or upload a smaller/simpler media file. If many users see this at once, treat it as a platform issue."
Pinterest,temporary_platform_error,PIN:12 | PIN:2787,Something went wrong on our end. Sorry about that.,"The platform returned a temporary server error or service unavailable response. The request reached the platform, but the platform could not complete it.","Ask the user to retry later. If many posts fail across accounts, treat it as a platform incident and escalate internally."
Pinterest,account_connection_expired,PIN:2,Authentication failed.,"Pinterest rejected authentication. Pinterest documents common token issues such as expired/invalid token, expired user session, or insufficient scopes.","Ask the user to reconnect Pinterest and grant the required scopes, then retry."
Pinterest,board_name_exists,PIN:58,Try a different name. You already have a board with this name!,Pinterest rejected the request because the account already has a board with the same name.,Ask the user to choose a different board name or select the existing board instead of creating a new one.
Pinterest,media_fetch_failed,PIN:2786,Unable to reach the URL. Please check the URL is correct and try again.,"The platform could not download the media from our hosted URL. This usually means the platform crawler was blocked, received 403, or could not access the media in time.","Retry the post first. If it repeats, escalate to support so we can check media URL accessibility, storage headers, robots/bot blocking, and platform crawler access."
Pinterest,network_error,NET:EAI_AGAIN,getaddrinfo EAI_AGAIN private-storage.bundle.social,"A network or DNS error interrupted the request between our system, media storage, and the platform.","Ask the user to retry. If multiple retries fail or many accounts are affected, escalate to support as an infrastructure/platform connectivity issue."
Reddit,community_does_not_allow_images,RD:RD:NO_IMAGES,This community doesn't allow images,The selected Reddit community does not allow image posts.,Ask the user to publish without an image or choose another community that allows images.
Reddit,post_flair_required,RD:RD:SUBMIT_VALIDATION_FLAIR_REQUIRED,Your post must contain post flair.,The selected Reddit community requires post flair.,Ask the user to choose a flair for the post or select another community.
Reddit,post_title_required,RD:RD:NO_TEXT,Post title is required,The platform requires a title for this post.,Ask the user to add a post title and retry.
Reddit,trusted_members_only,RD:RD:SUBREDDIT_NOTALLOWED,This community only allows trusted members to post here,The selected Reddit community only allows trusted members to post.,Ask the user to choose another community or request posting access from that community's moderators.
Bluesky,media_file_too_large,BSKY:400 | BSKY:502,This file is too large. It is SIZE but the maximum size is SIZE.,Bluesky rejected the media because it exceeded a file-size limit. Bluesky applies upload size limits at the PDS/video service level and may also have application-specific media limits.,"Ask the user to compress the media or upload a smaller file, then retry. 1 Mb max."
Bluesky,media_upload_failed,BSKY:502,video.uploadVideo failed: http_401,"The media upload did not complete successfully. This can be caused by platform upload processing, invalid media, expired upload sessions, or transient platform errors.","Ask the user to retry. If it repeats, ask them to replace or re-export the media file and try again."
Bluesky,internal_error,BSKY:UNKNOWN,Cannot read properties of null (reading 'substring'),A technical error happened while preparing or sending the request. The platform did not provide a user-fixable reason.,"Ask the user to retry once. If it repeats with the same post, escalate to support with the failed post ID and platform."
Google Business,invalid_request_arguments,GB:INVALID_ARGUMENT,Request contains an invalid argument.,"The platform rejected one or more post settings as invalid. This is usually a validation problem with the post payload, media, or selected account/location.","Review the post settings first. Ask the user to simplify the post, remove optional settings, or retry with valid media and account selections."
Mastodon,temporary_platform_error,MST:503,"This page is not correct - Mastodon We're sorry, but something went wrong on our end. You can check our status page to have more informations about our maintenances or incidents.","The platform returned a temporary server error or service unavailable response. The request reached the platform, but the platform could not complete it.","Ask the user to retry later. If many posts fail across accounts, treat it as a platform incident and escalate internally."
